{"schema":"relatte.dynamic-route-proposal.experimental/v0","field_plan_id":"field-plan:ae3d5f2f-2926-4c14-85bd-a9165544f5f1","view_digest":"sha256:26d4b3cad559949851275a755c1e305e5c5634e266985c82d94c9d84fad7dcff","observed_at":1000,"frontiers":[{"world_id":"world:6506087b58a232047c933cc203523f89e59171c75add4687fccc13af703e585b","head":"sha256:c2209f4a1e190ead0984c4690dd43c9488772636fc6a8a12659f99dc1d19dee1","count":4},{"world_id":"world:88a5dc9d62913f13705305796f7018129f70e2743d7bf3f0911cc413efe2c121","head":"sha256:7830b8b95ee60e3da8b96f6c206c0c58d6c24913aa74af8423536029135b00c3","count":4}],"route":{"schema":"relatte.route-candidate.experimental/v0","source_interface":"interface:808b5966","destination_goal":{"interface_id":"interface:552dd703-9534-4075-a884-33125591fc50","emits":"file.bytes"},"interface_sequence":["interface:808b5966","interface:552dd703-9534-4075-a884-33125591fc50"],"relation_sequence":["relation:6dbca995-b600-4275-bdda-404390808f12"],"constraints_considered":{"network":false,"preserve_ancestry":true,"mutation_authority":false,"loss_budget":0,"ordering":"ordered","reversible":false,"witnesses":[],"permissions":["interface:552dd703-9534-4075-a884-33125591fc50/observe"],"local_state":true,"max_depth":32,"max_candidates":128},"constraints_satisfied":["network","preserve_ancestry","mutation_authority","loss_budget","ordering","reversible","witnesses","permissions","local_state","max_depth","max_candidates"],"constraints_rejected":[],"planner_version":"interface-planner/0.1","registry_digest":"sha256:5a9de735b786eea700a336a32bc7bc0d314272a2c4b61d47e5e0b2fb09f90432","request":{"from":"interface:808b5966","state":{"representation":"payload.bytes","facts":["ordered"],"byte_length":19},"goal":{"interface_id":"interface:552dd703-9534-4075-a884-33125591fc50","emits":"file.bytes"},"constraints":{"network":false,"preserve_ancestry":true,"mutation_authority":false,"loss_budget":0,"ordering":"ordered","reversible":false,"witnesses":[],"permissions":["interface:552dd703-9534-4075-a884-33125591fc50/observe"],"local_state":true,"max_depth":32,"max_candidates":128}},"route_id":"route:a0732c0822e12b3543b951b6a5d9ce866d0001092eba43979cf60fe913b7cdfe","plan_digest":"sha256:9f7c61089d81aaae3428e9f557418516896082faf1b8e82efbec74404adc00e4"},"doors":[{"offer_id":"offer:01bfb3e5-4005-492f-985c-9fd05c56aabc","descriptor":{"schema":"relatte.interface-particular.experimental/v0","interface_id":"interface:808b5966","participant_ref":"participant:payload","plane":"transport","direction":"output","protocol":"in-process/v0","accepts":["payload.bytes"],"emits":["payload.bytes"],"operations":["observe","transmit","receive","propose"],"authority":{"observe":true,"propose":true,"authorize":false,"mutate":false},"information":{"capacity":1048576,"capacity_unit":"payload-bytes","timing_model":"occurrence time","ordering":"ordered","delivery":"bounded local observation","loss_profile":[],"native_dimensions":[]},"state":{"retention":"persistent","replayable":true},"evidence":{"produces":["native receipt"],"verification":["binding-local verification"],"source_ref":"caller-owned bytes"},"constraints":{"required":[],"forbidden":["authorize"]},"live":true,"capabilities":["observe","transmit","receive","propose"]},"descriptor_digest":"sha256:27e710eb35fb98e461660b921ececf1c5444e54598250270045a2caaab1dacb3","expires_at":61000,"parents":[],"world_id":"world:88a5dc9d62913f13705305796f7018129f70e2743d7bf3f0911cc413efe2c121","event_ref":"sha256:2433a9cdb782becc21ad5f88d794df5032be6a824a9f893b1aa44386e2f95a12"},{"offer_id":"offer:1841a5ed-be19-459b-b484-5c501f2f5f97","descriptor":{"schema":"relatte.interface-particular.experimental/v0","interface_id":"interface:552dd703-9534-4075-a884-33125591fc50","participant_ref":"composition-instance-v0:4c86f8481adc566992dea6cba8eedcf0cc8300848d549fc47bc7acb77189585d","plane":"transport","direction":"bidirectional","protocol":"in-process/v0","accepts":["file.bytes"],"emits":["file.bytes"],"operations":["observe","transmit","receive","propose"],"authority":{"observe":true,"propose":true,"authorize":false,"mutate":false},"information":{"capacity":1048576,"capacity_unit":"payload-bytes","timing_model":"occurrence time","ordering":"ordered","delivery":"bounded local observation","loss_profile":[],"native_dimensions":["path","device","inode"]},"state":{"retention":"persistent","replayable":true},"evidence":{"produces":["native receipt"],"verification":["binding-local verification"],"source_ref":"polyglot-crossing-001 observeFilesystem"},"constraints":{"required":[],"forbidden":["authorize"]},"live":true,"capabilities":["observe","transmit","receive","propose"]},"descriptor_digest":"sha256:2002b2b22f23a33c0a52118483f81eab5f1911ec2d010abe6f090872cb4346cc","expires_at":61000,"parents":[{"world_id":"world:218b8340514975b70f9e0f022292fcb30275e2d9aad9cea252e6fa2520fe69de","interface_id":"interface:552dd703-9534-4075-a884-33125591fc50","offer_id":"offer:720aa418-f84e-4b60-bc38-c3ccaaa85c28"}],"world_id":"world:6506087b58a232047c933cc203523f89e59171c75add4687fccc13af703e585b","event_ref":"sha256:8bd8fc0daf0097efb15d526d670f6fe73c8cb9dcdd7ad3faa109e12dcac1efca"}],"relations":[{"offer_id":"relation-offer:77847ece-e9b7-4664-afea-0021182d7972","descriptor":{"schema":"relatte.interface-relation.experimental/v0","relation_id":"relation:6dbca995-b600-4275-bdda-404390808f12","source":"interface:808b5966","destination":"interface:552dd703-9534-4075-a884-33125591fc50","kind":"transform","consumes":"payload.bytes","produces":"file.bytes","operation":"observe","preconditions":[],"postconditions":["ordered"],"removes":[],"preserves":{"bytes":true,"semantics":true,"ancestry":true,"order":true,"timing":false,"particular_identity":false},"may_lose":[],"reversible":true,"loss_cost":0,"requires":{"network":false,"live_participant":true,"local_state":false,"witness":null,"authority":"observe"},"binding_ref":"binding:2c268110","verification_ref":"verification:2c268110"},"source":{"world_id":"world:88a5dc9d62913f13705305796f7018129f70e2743d7bf3f0911cc413efe2c121","interface_id":"interface:808b5966","offer_id":"offer:01bfb3e5-4005-492f-985c-9fd05c56aabc","descriptor_digest":"sha256:27e710eb35fb98e461660b921ececf1c5444e54598250270045a2caaab1dacb3"},"destination":{"world_id":"world:6506087b58a232047c933cc203523f89e59171c75add4687fccc13af703e585b","interface_id":"interface:552dd703-9534-4075-a884-33125591fc50","offer_id":"offer:1841a5ed-be19-459b-b484-5c501f2f5f97","descriptor_digest":"sha256:2002b2b22f23a33c0a52118483f81eab5f1911ec2d010abe6f090872cb4346cc"},"expires_at":61000,"world_id":"world:6506087b58a232047c933cc203523f89e59171c75add4687fccc13af703e585b","event_ref":"sha256:c2209f4a1e190ead0984c4690dd43c9488772636fc6a8a12659f99dc1d19dee1"}],"authority":[],"field_plan_digest":"sha256:92e144ef009014164f4f81c0c7485dd330c6836290f44821a093fd49c91c9a95"}