{"schema":"relatte.dynamic-route-proposal.experimental/v0","field_plan_id":"field-plan:bdf31172-13a7-4708-984e-a754e98a7149","view_digest":"sha256:16ddc34dc447d3b176af69f2fec42235e656fe1f21b1aa27fbe692605180ca33","observed_at":1000,"frontiers":[{"world_id":"world:218b8340514975b70f9e0f022292fcb30275e2d9aad9cea252e6fa2520fe69de","head":"sha256:de24df16af65cca728f1bf504fc7fe650c9c319e8a62c5504f67a844d9810df6","count":6},{"world_id":"world:88a5dc9d62913f13705305796f7018129f70e2743d7bf3f0911cc413efe2c121","head":"sha256:04e5360f80ad0abcef11a24bd140dc25a702a4c53840d5fb6a6f79157ded8a98","count":3}],"route":{"schema":"relatte.route-candidate.experimental/v0","source_interface":"interface:808b5966","destination_goal":{"interface_id":"interface:eb1d970e-82b5-4570-acd1-bbeda03222cf","emits":"file.bytes"},"interface_sequence":["interface:808b5966","interface:eb1d970e-82b5-4570-acd1-bbeda03222cf"],"relation_sequence":["relation:ed44b3fa-c88f-4e76-aac9-d3d277a9cb2c"],"constraints_considered":{"network":false,"preserve_ancestry":true,"mutation_authority":false,"loss_budget":0,"ordering":"ordered","reversible":false,"witnesses":[],"permissions":["interface:eb1d970e-82b5-4570-acd1-bbeda03222cf/observe"],"local_state":true,"max_depth":32,"max_candidates":128},"constraints_satisfied":["network","preserve_ancestry","mutation_authority","loss_budget","ordering","reversible","witnesses","permissions","local_state","max_depth","max_candidates"],"constraints_rejected":[],"planner_version":"interface-planner/0.1","registry_digest":"sha256:aaf3abba3456fdd1e6212c5cad1d528e4d707143a2d6c70d12ae8f1e1a56c757","request":{"from":"interface:808b5966","state":{"representation":"payload.bytes","facts":["ordered"],"byte_length":19},"goal":{"interface_id":"interface:eb1d970e-82b5-4570-acd1-bbeda03222cf","emits":"file.bytes"},"constraints":{"network":false,"preserve_ancestry":true,"mutation_authority":false,"loss_budget":0,"ordering":"ordered","reversible":false,"witnesses":[],"permissions":["interface:eb1d970e-82b5-4570-acd1-bbeda03222cf/observe"],"local_state":true,"max_depth":32,"max_candidates":128}},"route_id":"route:4591e7b35a47a29124957cd9ebcf58562de3775a1f56fef0dc9e6b00db2b6505","plan_digest":"sha256:a5c49578437b2e2d52854e0c4db1878af0be1b938168ef4febf89dbace9ca59f"},"doors":[{"offer_id":"offer:01bfb3e5-4005-492f-985c-9fd05c56aabc","descriptor":{"schema":"relatte.interface-particular.experimental/v0","interface_id":"interface:808b5966","participant_ref":"participant:payload","plane":"transport","direction":"output","protocol":"in-process/v0","accepts":["payload.bytes"],"emits":["payload.bytes"],"operations":["observe","transmit","receive","propose"],"authority":{"observe":true,"propose":true,"authorize":false,"mutate":false},"information":{"capacity":1048576,"capacity_unit":"payload-bytes","timing_model":"occurrence time","ordering":"ordered","delivery":"bounded local observation","loss_profile":[],"native_dimensions":[]},"state":{"retention":"persistent","replayable":true},"evidence":{"produces":["native receipt"],"verification":["binding-local verification"],"source_ref":"caller-owned bytes"},"constraints":{"required":[],"forbidden":["authorize"]},"live":true,"capabilities":["observe","transmit","receive","propose"]},"descriptor_digest":"sha256:27e710eb35fb98e461660b921ececf1c5444e54598250270045a2caaab1dacb3","expires_at":61000,"parents":[],"world_id":"world:88a5dc9d62913f13705305796f7018129f70e2743d7bf3f0911cc413efe2c121","event_ref":"sha256:2433a9cdb782becc21ad5f88d794df5032be6a824a9f893b1aa44386e2f95a12"},{"offer_id":"offer:87e5cd90-6e60-40d2-8963-b414949f0af6","descriptor":{"schema":"relatte.interface-particular.experimental/v0","interface_id":"interface:eb1d970e-82b5-4570-acd1-bbeda03222cf","participant_ref":"composition-instance-v0:4c86f8481adc566992dea6cba8eedcf0cc8300848d549fc47bc7acb77189585d","plane":"transport","direction":"bidirectional","protocol":"in-process/v0","accepts":["file.bytes"],"emits":["file.bytes"],"operations":["observe","transmit","receive","propose"],"authority":{"observe":true,"propose":true,"authorize":false,"mutate":false},"information":{"capacity":1048576,"capacity_unit":"payload-bytes","timing_model":"occurrence time","ordering":"ordered","delivery":"bounded local observation","loss_profile":[],"native_dimensions":["path","device","inode"]},"state":{"retention":"persistent","replayable":true},"evidence":{"produces":["native receipt"],"verification":["binding-local verification"],"source_ref":"polyglot-crossing-001 observeFilesystem"},"constraints":{"required":[],"forbidden":["authorize"]},"live":true,"capabilities":["observe","transmit","receive","propose"]},"descriptor_digest":"sha256:50cb95282bc630312b4798ff07faaa04c2eb78ae6add541c243835ae7ad6a06c","expires_at":61000,"parents":[{"world_id":"world:218b8340514975b70f9e0f022292fcb30275e2d9aad9cea252e6fa2520fe69de","interface_id":"interface:552dd703-9534-4075-a884-33125591fc50","offer_id":"offer:720aa418-f84e-4b60-bc38-c3ccaaa85c28"}],"world_id":"world:218b8340514975b70f9e0f022292fcb30275e2d9aad9cea252e6fa2520fe69de","event_ref":"sha256:6c0f2e7049e9511c765e752ac1cb3c2dbfef50ed08cb525ca75dca4536ba36b2"}],"relations":[{"offer_id":"relation-offer:47b09352-23bb-4064-b509-b5c24e4beb4e","descriptor":{"schema":"relatte.interface-relation.experimental/v0","relation_id":"relation:ed44b3fa-c88f-4e76-aac9-d3d277a9cb2c","source":"interface:808b5966","destination":"interface:eb1d970e-82b5-4570-acd1-bbeda03222cf","kind":"transform","consumes":"payload.bytes","produces":"file.bytes","operation":"observe","preconditions":[],"postconditions":["ordered"],"removes":[],"preserves":{"bytes":true,"semantics":true,"ancestry":true,"order":true,"timing":false,"particular_identity":false},"may_lose":[],"reversible":true,"loss_cost":0,"requires":{"network":false,"live_participant":true,"local_state":false,"witness":null,"authority":"observe"},"binding_ref":"binding:2c268110","verification_ref":"verification:2c268110"},"source":{"world_id":"world:88a5dc9d62913f13705305796f7018129f70e2743d7bf3f0911cc413efe2c121","interface_id":"interface:808b5966","offer_id":"offer:01bfb3e5-4005-492f-985c-9fd05c56aabc","descriptor_digest":"sha256:27e710eb35fb98e461660b921ececf1c5444e54598250270045a2caaab1dacb3"},"destination":{"world_id":"world:218b8340514975b70f9e0f022292fcb30275e2d9aad9cea252e6fa2520fe69de","interface_id":"interface:eb1d970e-82b5-4570-acd1-bbeda03222cf","offer_id":"offer:87e5cd90-6e60-40d2-8963-b414949f0af6","descriptor_digest":"sha256:50cb95282bc630312b4798ff07faaa04c2eb78ae6add541c243835ae7ad6a06c"},"expires_at":61000,"world_id":"world:218b8340514975b70f9e0f022292fcb30275e2d9aad9cea252e6fa2520fe69de","event_ref":"sha256:de24df16af65cca728f1bf504fc7fe650c9c319e8a62c5504f67a844d9810df6"}],"authority":[],"field_plan_digest":"sha256:eb70fabdc700540f2947afa799cf0f7256972fa9e5cae94b1f18b260d0718a33"}