{"schema":"relatte.dynamic-route-proposal.experimental/v0","field_plan_id":"field-plan:1d721a33-fb67-4e36-abab-f0672176c326","view_digest":"sha256:7e0433f3b2c2c3dc851d5b826293896d9112cfa4d388c9390b6c2f753858bed7","observed_at":1000,"frontiers":[{"world_id":"world:218b8340514975b70f9e0f022292fcb30275e2d9aad9cea252e6fa2520fe69de","head":"sha256:9c8c7081aa5605fe3b3935fe406f831353d5ce49f4f23b6a0982ec75275cc03f","count":3},{"world_id":"world:88a5dc9d62913f13705305796f7018129f70e2743d7bf3f0911cc413efe2c121","head":"sha256:2433a9cdb782becc21ad5f88d794df5032be6a824a9f893b1aa44386e2f95a12","count":2}],"route":{"schema":"relatte.route-candidate.experimental/v0","source_interface":"interface:808b5966","destination_goal":{"interface_id":"interface:552dd703-9534-4075-a884-33125591fc50","emits":"file.bytes"},"interface_sequence":["interface:808b5966","interface:552dd703-9534-4075-a884-33125591fc50"],"relation_sequence":["relation:986e798e-a8ad-4977-aea4-986531f78ecc"],"constraints_considered":{"network":false,"preserve_ancestry":true,"mutation_authority":false,"loss_budget":0,"ordering":"ordered","reversible":false,"witnesses":[],"permissions":["interface:552dd703-9534-4075-a884-33125591fc50/observe"],"local_state":true,"max_depth":32,"max_candidates":128},"constraints_satisfied":["network","preserve_ancestry","mutation_authority","loss_budget","ordering","reversible","witnesses","permissions","local_state","max_depth","max_candidates"],"constraints_rejected":[],"planner_version":"interface-planner/0.1","registry_digest":"sha256:79aab61a8bc469afad31629b51589eb19d9c6bf1fd770909aa8a9d04e727d733","request":{"from":"interface:808b5966","state":{"representation":"payload.bytes","facts":["ordered"],"byte_length":19},"goal":{"interface_id":"interface:552dd703-9534-4075-a884-33125591fc50","emits":"file.bytes"},"constraints":{"network":false,"preserve_ancestry":true,"mutation_authority":false,"loss_budget":0,"ordering":"ordered","reversible":false,"witnesses":[],"permissions":["interface:552dd703-9534-4075-a884-33125591fc50/observe"],"local_state":true,"max_depth":32,"max_candidates":128}},"route_id":"route:8370de2e207343bf0b65ad94b0f09c1c54a7362fd1277fd70669c6d378d5aec7","plan_digest":"sha256:f5f99b5a6eddbc54c9df4195dae2970a4732747c75ad1896f6a5da6b0ffc0df0"},"doors":[{"offer_id":"offer:01bfb3e5-4005-492f-985c-9fd05c56aabc","descriptor":{"schema":"relatte.interface-particular.experimental/v0","interface_id":"interface:808b5966","participant_ref":"participant:payload","plane":"transport","direction":"output","protocol":"in-process/v0","accepts":["payload.bytes"],"emits":["payload.bytes"],"operations":["observe","transmit","receive","propose"],"authority":{"observe":true,"propose":true,"authorize":false,"mutate":false},"information":{"capacity":1048576,"capacity_unit":"payload-bytes","timing_model":"occurrence time","ordering":"ordered","delivery":"bounded local observation","loss_profile":[],"native_dimensions":[]},"state":{"retention":"persistent","replayable":true},"evidence":{"produces":["native receipt"],"verification":["binding-local verification"],"source_ref":"caller-owned bytes"},"constraints":{"required":[],"forbidden":["authorize"]},"live":true,"capabilities":["observe","transmit","receive","propose"]},"descriptor_digest":"sha256:27e710eb35fb98e461660b921ececf1c5444e54598250270045a2caaab1dacb3","expires_at":61000,"parents":[],"world_id":"world:88a5dc9d62913f13705305796f7018129f70e2743d7bf3f0911cc413efe2c121","event_ref":"sha256:2433a9cdb782becc21ad5f88d794df5032be6a824a9f893b1aa44386e2f95a12"},{"offer_id":"offer:720aa418-f84e-4b60-bc38-c3ccaaa85c28","descriptor":{"schema":"relatte.interface-particular.experimental/v0","interface_id":"interface:552dd703-9534-4075-a884-33125591fc50","participant_ref":"composition-instance-v0:4c86f8481adc566992dea6cba8eedcf0cc8300848d549fc47bc7acb77189585d","plane":"transport","direction":"bidirectional","protocol":"in-process/v0","accepts":["file.bytes"],"emits":["file.bytes"],"operations":["observe","transmit","receive","propose"],"authority":{"observe":true,"propose":true,"authorize":false,"mutate":false},"information":{"capacity":1048576,"capacity_unit":"payload-bytes","timing_model":"occurrence time","ordering":"ordered","delivery":"bounded local observation","loss_profile":[],"native_dimensions":["path","device","inode"]},"state":{"retention":"persistent","replayable":true},"evidence":{"produces":["native receipt"],"verification":["binding-local verification"],"source_ref":"polyglot-crossing-001 observeFilesystem"},"constraints":{"required":[],"forbidden":["authorize"]},"live":true,"capabilities":["observe","transmit","receive","propose"]},"descriptor_digest":"sha256:2002b2b22f23a33c0a52118483f81eab5f1911ec2d010abe6f090872cb4346cc","expires_at":61000,"parents":[],"world_id":"world:218b8340514975b70f9e0f022292fcb30275e2d9aad9cea252e6fa2520fe69de","event_ref":"sha256:d9b3c1b7cbe3ddf72e3b94a49f9afb54d397f28edd06e61bc713b025a4dd5596"}],"relations":[{"offer_id":"relation-offer:6b2f1e09-d2a5-4258-9949-be9b71685d82","descriptor":{"schema":"relatte.interface-relation.experimental/v0","relation_id":"relation:986e798e-a8ad-4977-aea4-986531f78ecc","source":"interface:808b5966","destination":"interface:552dd703-9534-4075-a884-33125591fc50","kind":"transform","consumes":"payload.bytes","produces":"file.bytes","operation":"observe","preconditions":[],"postconditions":["ordered"],"removes":[],"preserves":{"bytes":true,"semantics":true,"ancestry":true,"order":true,"timing":false,"particular_identity":false},"may_lose":[],"reversible":true,"loss_cost":0,"requires":{"network":false,"live_participant":true,"local_state":false,"witness":null,"authority":"observe"},"binding_ref":"binding:2c268110","verification_ref":"verification:2c268110"},"source":{"world_id":"world:88a5dc9d62913f13705305796f7018129f70e2743d7bf3f0911cc413efe2c121","interface_id":"interface:808b5966","offer_id":"offer:01bfb3e5-4005-492f-985c-9fd05c56aabc","descriptor_digest":"sha256:27e710eb35fb98e461660b921ececf1c5444e54598250270045a2caaab1dacb3"},"destination":{"world_id":"world:218b8340514975b70f9e0f022292fcb30275e2d9aad9cea252e6fa2520fe69de","interface_id":"interface:552dd703-9534-4075-a884-33125591fc50","offer_id":"offer:720aa418-f84e-4b60-bc38-c3ccaaa85c28","descriptor_digest":"sha256:2002b2b22f23a33c0a52118483f81eab5f1911ec2d010abe6f090872cb4346cc"},"expires_at":61000,"world_id":"world:218b8340514975b70f9e0f022292fcb30275e2d9aad9cea252e6fa2520fe69de","event_ref":"sha256:9c8c7081aa5605fe3b3935fe406f831353d5ce49f4f23b6a0982ec75275cc03f"}],"authority":[],"field_plan_digest":"sha256:54e7241f7c96f93c88c627bfdb09b557ff61cdaa88ad9b405764e374e20378ee"}